ITEM_ID,ITEM_NAME,ITEM_NAME,OPTION_TYPE,DEFAULT_VALUE,MIN_VALUE,MAX_VALUE,UNIT_VALUE,UI_TEXT_ITEM,UI_TEXT_ITEM,ITEM_DESCRIPTION,
10001,ITEM_NAME_10001,조명,1,50,0,100,10,UI_TEXT_ITEM_10001,현재 밝기는 {00}입니다.,ITEM_DESCRIPTION_10001,실내의 밝기를 조절할 수 있는 아이템.
20001,ITEM_NAME_20001,가습기,3,0,0,100,10,UI_TEXT_ITEM_30001,현재 습도는 {00}%입니다.,ITEM_DESCRIPTION_20001,실내의 습도를 조절할 수 있는 아이템.
30001,ITEM_NAME_30001,에어컨,2,-10,-10,-50,10,UI_TEXT_ITEM_20001,현재 온도는 {00}°C입니다.,ITEM_DESCRIPTION_30001,실내 온도를 얼음이 얼 수 있을 정도로 낮출 수 있는 강력한 장치.
40001,ITEM_NAME_40001,난로,4,1,1,5,1,UI_TEXT_ITEM_40001,현재 화력은 {00}단계입니다.,ITEM_DESCRIPTION_40001,불의 세기를 높여 실내 온도를 아주 뜨겁게 만들 수 있다.
100001,ITEM_NAME_100001,화분,10,1,0,1,1,UI_TEXT_ITEM_100001,0,ITEM_DESCRIPTION_100001,배치 시 식물을 좋아하는 슬라임이 생길 것 같다.
